Exp5 : DML COMMAND- DELETE


1) Delete the record of customer id ‘106'?

mysql> DELETE FROM CUSTOMER WHERE ID=106;
Query OK, 1 row affected (0.04 sec)

mysql> SELECT * FROM CUSTOMER;
+-----+------------+---------------------+-----------+----------+
| ID  | NAME       | ADDRESS             | CITY      | PH_NO    |
+-----+------------+---------------------+-----------+----------+
| 101 | ANDREW     | GREEN VILLA(H)      | KOZHIKODE |  4244343 |
| 102 | ARNOLD     | MOUNT VILLA(H)      | EKM       | 42342443 |
| 103 | RUTHERFORD | RIVER VILLA(H)      | USA       | 15235422 |
| 104 | FINCH      | DREAM VILLA(H)      | GOA       | 42232567 |
| 105 | BERVIS     | DEMOCRATIC VILLA(H) | ASSAM     | 42232989 |
+-----+------------+---------------------+-----------+----------+
5 rows in set (0.00 sec)



2) Delete all purchase details of items its quantity less than 2?

mysql> SELECT * FROM INVOICE_ITEM;
+--------+------+----------+
| INV_ID | PID  | QUANTITY |
+--------+------+----------+
|      1 |   10 |       50 |
|      2 |   21 |       20 |
|      3 |   25 |       10 |
|      3 |   15 |       10 |
|      4 |   21 |       16 |
|      5 |   18 |      105 |
|      6 |   10 |       75 |
|      6 |   18 |       60 |
|      7 |   15 |       43 |
|      7 |   25 |       21 |
+--------+------+----------+
10 rows in set (0.00 sec)

mysql> DELETE FROM INVOICE_ITEM WHERE QUANTITY<15;
Query OK, 2 rows affected (0.04 sec)

mysql> SELECT * FROM INVOICE_ITEM;
+--------+------+----------+
| INV_ID | PID  | QUANTITY |
+--------+------+----------+
|      1 |   10 |       50 |
|      2 |   21 |       20 |
|      4 |   21 |       16 |
|      5 |   18 |      105 |
|      6 |   10 |       75 |
|      6 |   18 |       60 |
|      7 |   15 |       43 |
|      7 |   25 |       21 |
+--------+------+----------+
8 rows in set (0.00 sec)




3) Delete the purchase details of product ‘pen’ in the inv_id ‘6'?

mysql> DELETE FROM INVOICE_ITEM WHERE INV_ID=6 AND PID=10;
Query OK, 1 row affected (0.04 sec)

mysql> SELECT * FROM INVOICE_ITEM;
+--------+------+----------+
| INV_ID | PID  | QUANTITY |
+--------+------+----------+
|      1 |   10 |       50 |
|      2 |   21 |       20 |
|      4 |   21 |       16 |
|      5 |   18 |      105 |
|      6 |   18 |       60 |
|      7 |   15 |       43 |
|      7 |   25 |       21 |
+--------+------+----------+
7 rows in set (0.01 sec)




4) Delete details of employees who does not have phone number?

mysql> DELETE FROM CUSTOMER WHERE PH_NO IS NULL;
Query OK, 1 row affected (0.04 sec)

mysql> SELECT * FROM CUSTOMER;
+-----+------------+----------------+-----------+----------+
| ID  | NAME       | ADDRESS        | CITY      | PH_NO    |
+-----+------------+----------------+-----------+----------+
| 101 | ANDREW     | GREEN VILLA(H) | KOZHIKODE |  4244343 |
| 102 | ARNOLD     | MOUNT VILLA(H) | EKM       | 42342443 |
| 103 | RUTHERFORD | RIVER VILLA(H) | USA       | 15235422 |
| 104 | FINCH      | DREAM VILLA(H) | GOA       | 42232567 |
+-----+------------+----------------+-----------+----------+
4 rows in set (0.00 sec)


5) Delete Invoice details of a particular customer?

mysql> DELETE FROM STUDENT WHERE GENDER='M' OR GENDER='F';
Query OK, 5 rows affected (0.04 sec)
mysql> SELECT * FROM STUDENT;
Empty set (0.00 sec)




6) Delete Invoice details of a particular customer?

mysql> SELECT * FROM INVOICE_ITEM;
+--------+------+----------+
| INV_ID | PID  | QUANTITY |
+--------+------+----------+
|      1 |   10 |       50 |
|      2 |   21 |       20 |
|      4 |   21 |       16 |
|      5 |   18 |      105 |
|      6 |   18 |       60 |
|      7 |   15 |       43 |
|      7 |   25 |       21 |
+--------+------+----------+
7 rows in set (0.00 sec)

mysql> DELETE FROM INVOICE_ITEM WHERE INV_ID=2 OR INV_ID=6;
Query OK, 2 rows affected (0.03 sec)

mysql> SELECT * FROM INVOICE_ITEM;
+--------+------+----------+
| INV_ID | PID  | QUANTITY |
+--------+------+----------+
|      1 |   10 |       50 |
|      4 |   21 |       16 |
|      5 |   18 |      105 |
|      7 |   15 |       43 |
|      7 |   25 |       21 |
+--------+------+----------+
5 rows in set (0.00 sec)

mysql> SELECT * FROM INVOICE_MASTER;
+--------+---------+------------+
| INV_ID | CUST_ID | INV_DATE   |
+--------+---------+------------+
|      1 |     101 | 2021-04-24 |
|      2 |     102 | 2021-09-12 |
|      4 |     104 | 2022-04-16 |
|      5 |     104 | 2022-05-18 |
|      6 |     102 | 2022-05-18 |
|      7 |     101 | 2022-06-20 |
+--------+---------+------------+
6 rows in set (0.00 sec)

mysql> DELETE FROM INVOICE_MASTER WHERE CUST_ID=102;
Query OK, 2 rows affected (0.03 sec)

mysql> SELECT * FROM INVOICE_MASTER;
+--------+---------+------------+
| INV_ID | CUST_ID | INV_DATE   |
+--------+---------+------------+
|      1 |     101 | 2021-04-24 |
|      4 |     104 | 2022-04-16 |
|      5 |     104 | 2022-05-18 |
|      7 |     101 | 2022-06-20 |
+--------+---------+------------+
4 rows in set (0.00 sec)



7) Delete the first two records of INVOICE_ITEM table its purchase quantity is high?

mysql> SELECT * FROM INVOICE_ITEM;
+--------+------+----------+
| INV_ID | PID  | QUANTITY |
+--------+------+----------+
|      1 |   10 |       50 |
|      4 |   21 |       16 |
|      5 |   18 |      105 |
|      7 |   15 |       43 |
|      7 |   25 |       21 |
+--------+------+----------+
5 rows in set (0.00 sec)


mysql> DELETE FROM INVOICE_ITEM ORDER BY QUANTITY DESC LIMIT 2;
Query OK, 2 rows affected (0.04 sec)

mysql> SELECT * FROM INVOICE_ITEM;
+--------+------+----------+
| INV_ID | PID  | QUANTITY |
+--------+------+----------+
|      4 |   21 |       16 |
|      7 |   15 |       43 |
|      7 |   25 |       21 |
+--------+------+----------+
3 rows in set (0.00 sec)


//VERIFIED
